,Published,Title,Body,Company,Source
199,2018-02-06T04:09:52Z,SpaceX set to fire Elon Musk’s Roadster into orbit on back of world’s ‘most powerful’ rocket,"A cherry red Tesla Roadster owned by Elon Musk is set to be fired into space on SpaceX’s Falcon Heavy rocket. The private space company, headed by Tesla CEO Musk, hopes to launch what it calls “the most powerful operational rocket” from Florida’s Kennedy Spac…",tesla,CNBC
200,2018-03-28T11:30:15Z,"A Terrible Tuesday for Tesla's Stock, But Watch the Bonds",Fixed-income investors are suddenly less sanguine about the risks.,tesla,Bloomberg
201,2018-02-28T10:22:39Z,Musk Dream of Space-Based Internet Sent Others Crashing to Earth - Bloomberg,"Bloomberg Musk Dream of Space-Based Internet Sent Others Crashing to Earth Bloomberg When Elon Musk's SpaceX heaved two communications satellites aloft last week, he joined a space race that's foiled plenty of other dreamers. Billions of dollars have vanished…",tesla,Bloomberg
202,2018-03-01T15:33:00Z,"Latest 'arms race' is stealing computing power to mine crypto, says RedLock CEO","""Money doesn't grow on trees but it, in fact, does today with cryptocurrencies,"" RedLock chief Varun Badhwar says.",tesla,CNBC
203,2018-01-25T09:35:00Z,"Innovators such as Tesla are fast-tracking a technology 'renaissance,' CEO says","Rapid advancements in technology will help to create ""completely new"" industry solutions over the coming years, Bernard Charles said Thursday.",tesla,CNBC
204,2018-01-18T16:34:00Z,"Apple, Google and Microsoft top list of the most innovative companies in 2018","Apple, Google and Microsoft topped the 2018 list of the most innovative companies.",tesla,CNBC
205,2018-01-24T19:12:00Z,"SpaceX test fires Falcon Heavy, one of the most powerful rockets ever","SpaceX test fired its Falcon Heavy rocket on Wednesday, bringing it one step closer its inaugural launch.",tesla,CNBC
206,2018-01-23T15:41:42Z,The Genius of Elon Musk’s New Compensation Plan,"New plan offers potential for big rewards, especially when you consider what's not included.",tesla,The Wall Street Journal
207,2018-01-26T00:00:01Z,Best-Performing Battery Metal of the Past Year Isn't Cobalt,"A metal that's in demand for batteries is surging, and it's not the one everyone's talking about.",tesla,Bloomberg
208,2018-01-05T09:04:00Z,"SpaceX will launch ‘most powerful rocket in the world’ this month, and with a Tesla on board","SpaceX claims the Falcon Heavy is the ""most powerful rocket in the world by a factor of two.""",tesla,CNBC
209,2018-01-11T22:42:36Z,India Turns Tesla's Business Model on Its Head - Bloomberg,Bloomberg India Turns Tesla's Business Model on Its Head Bloomberg Tesla Inc. helped electric vehicles gain a mainstream foothold in the U.S. by starting with luxury cars and then moving down-market. India's nascent transition to EVs is heading in the opposit…,tesla,Bloomberg
210,2018-03-19T23:14:06Z,The Uber Crash Is the Nightmare the Driverless World Feared But Expected - Bloomberg,"Bloomberg The Uber Crash Is the Nightmare the Driverless World Feared But Expected Bloomberg Bloomberg's Eric Newcomer reports on the fatal accident involving an Uber self-driving vehicle in Arizona. Last week, Waymo showed a video of people riding in its sel…",tesla,Bloomberg
211,2018-03-29T17:58:11Z,Tesla's Push to Prove the Haters Wrong Only Proves Them Right,"Until it can sustainably keep up Model 3 production, investors are right to be anxious.",tesla,Bloomberg
212,2018-01-08T23:14:00Z,Cramer says 4 things—including the tax overhaul—will continue to push stocks higher,"Jim Cramer explained how index funds, stock shortages, tax cuts and low valuations all coalesce to drive stocks higher.",tesla,CNBC
213,2018-03-09T07:44:00Z,It's time to ask China to rein in protectionist practices — but the US can't do it alone,"""It works better when you have a number of countries doing this together, not just the United States badgering China,"" says the Cato Institute.",tesla,CNBC
214,2018-02-01T03:22:37Z,"GM Ramps Up Testing of Self-Driving Cars, But Still Lags Waymo","GM reported progress in the consistency of its autonomous-driving system last year as it sharply increased testing on the roads of California, though it remained well behind the self-driving tech unit of Google-parent Alphabet Inc., according to state records.",tesla,The Wall Street Journal
215,2018-02-08T22:19:27Z,Market Tumble Wipes Out Almost $100 Billion From World's Richest,"Swooning markets Thursday cost the world's 500 richest people $93 billion in net worth, and 20 of them lost at least $1 billion each.",tesla,Bloomberg
216,2018-03-01T18:00:00Z,Jaguar Previews I-Pace SUV in Launch of Battery-Powered Line-Up,Jaguar offered an online preview of its fully electric I-Pace sport utility vehicle as the U.K. luxury-car maker pushes forward with plans to challenge Tesla Inc. and offer a battery-powered line-up by the end of the decade.,tesla,Bloomberg
217,2018-01-17T21:02:00Z,"Early reviews heap praise on Tesla's Model 3, with a few caveats","Reviewers appreciate much about Tesla's lowest-priced car, but point out some issues with its design and execution.",tesla,CNBC
218,2018-01-25T11:30:17Z,"Fly Charts: Elon Musk's Bond Boon, GE's Disaster Carousel","From the benefits of Qualcomm's size to Macron's fancy party, here are four charts that tell you what you need to know in business today.",tesla,Bloomberg
219,2018-01-30T06:27:00Z,Check out the country where a luxury Tesla has become the budget option,"Subsidies, free parking, and toll-free roads are all part of the package.",tesla,CNBC
220,2018-03-07T19:48:24Z,GM CEO Pushes for Renewed Tax Breaks on Electric Vehicles,"General Motors Co. Chief Executive Mary Barra is pressing Washington for an expansion of electric-vehicle tax credits, a plea that would help the company and rivals like Tesla Inc. sell battery-powered cars in an era of cheap gasoline and skepticism about alt…",tesla,The Wall Street Journal
221,2018-01-04T11:26:05Z,Five Things You Need to Know to Start Your Day,Get caught up on what's moving markets.,tesla,Bloomberg
222,2018-01-23T21:30:27Z,Your Evening Briefing,Here are today's top stories,tesla,Bloomberg
223,2018-01-23T12:59:00Z,"Stocks making the biggest moves premarket: JNJ, PG, VZ, JPM, NFLX, ADBE & more",These are the stocks posting the largest moves before the bell.,tesla,CNBC
224,2018-03-28T20:29:27Z,Big Trade Rattles Nasdaq Futures Before Open,An unusually large trade in Nasdaq futures roiled prices shortly before the market opened and the tech sell-off resumed Wednesday morning.,tesla,The Wall Street Journal
225,2018-02-21T09:30:00Z,Hackers hijack Tesla’s cloud system to mine cryptocurrency,"Tesla's Amazon Web Services (AWS) cloud account was compromised by hackers and used for cryptocurrency mining, RedLock said.",tesla,CNBC
226,2018-02-07T23:00:00Z,"After-hours buzz: IRBT, YELP, YUMC & more",See which stocks are posting big moves after the bell.,tesla,CNBC
227,2018-02-16T21:55:00Z,"Even as California embraces electric vehicles, pickup trucks still rule its roads",Data from the California New Car Dealers Association shows the Ford F-Series pickup outsold all pure electric vehicles combined in 2017.,tesla,CNBC
228,2018-02-01T16:31:00Z,"David Einhorn's hedge fund is getting crushed because of ill-timed bets against Amazon, Tesla during market surge","Greenlight Capital Offshore declined 6 percent in January, while the Greenlight Capital, LP fund dropped 6.6 percent.",tesla,CNBC
229,2018-01-23T10:00:00Z,Robots Rejected: Humans Still Build the Best New Car You Can Buy,"More than three decades after Honda Motor Co. first built an Accord sedan at its Marysville, Ohio, factory in 1982, humans are still an integral part of the assembly process -- and that's unlikely to change anytime soon.",tesla,Bloomberg
230,2018-03-13T16:07:38Z,Volkswagen Vows to Overtake Tesla With World's Largest Electric Car Fleet,The German car giant has pulled into Tesla’s rearview and vowed to overtake the electric vehicle pioneer with a massive rollout of battery and hybrid models over the next five years and production facilities around the world.,tesla,The Wall Street Journal
231,2018-02-07T12:08:00Z,"Money manager known for bold calls sees Tesla going to $4,000 — an increase of 1,100%","""If we're wrong, and all they do is electric, our bear case is $600,"" Wood says, a level that's still a double.",tesla,CNBC
232,2018-03-23T17:07:00Z,"In Twitter rant, Elon Musk says he's deleting Tesla and SpaceX Facebook accounts",“What’s Facebook?” billionaire tech titan Elon Musk taunts.,tesla,CNBC
233,2018-03-05T12:50:15Z,"In the Age of Tesla, Trump Is Driving a Rusty Old Ford","Technology, not tariffs, will decide the fate of Detroit.",tesla,Bloomberg
234,2018-03-09T14:32:52Z,Auto Industry's Cure for Electric Car Blues: Be More Like Tesla,Car makers plan to invest $70 billion to introduce a new generation of more stylish electric vehicles.,tesla,The Wall Street Journal
235,2018-03-05T12:00:00Z,Low profile electric car firm with Tesla co-founder begins testing autonomous driving in California,"SF Motors is ready to being raising its profile, said CTO Yifan Tang.",tesla,CNBC
236,2018-03-01T18:13:00Z,"Watch Jaguar unveil its first all-electric vehicle, designed to take on Tesla Model X",The I-PACE will debut on March 6 at the Geneva Auto Show.,tesla,CNBC
237,2018-03-03T00:10:00Z,"Top VC deals: Amazon buys Ring, while Spotify and Dropbox prepare to go public","A weekly recap of some of the most interesting venture capital deals, funds and start-ups.",tesla,CNBC
238,2018-02-15T22:35:00Z,"As Puerto Rico pushes forward with new fiscal plan, Tesla and others propose energy fixes","With $17 billion in federal funds, the new plan covers a six-year period and projects a budget surplus",tesla,CNBC
239,2018-02-23T10:00:00Z,How Tesla and Google Jets Could Enrich a Money-Losing Gold Miner,Long-struggling Comstock Mining Inc. may finally have its mother lode.,tesla,Bloomberg
240,2018-02-28T16:09:00Z,Porsche's US dealers will offer fast charging stations for its Tesla-fighting Mission E sedan,"Forgot to charge your Porsche? No need to ask for a charger, Porsche has got you covered. USAToday reports.",tesla,CNBC
241,2018-01-09T05:22:00Z,'It might raise national security issues': China may not welcome foreign driverless tech,It might not be easy for foreign firms looking to install autonomous driving systems in Chinese cars.,tesla,CNBC
242,2018-03-08T13:25:00Z,"Stocks making the biggest moves premarket: CI, WYNN, XOM, AAPL, AMZN, JPM & more",These are the stocks posting the largest moves before the bell.,tesla,CNBC
243,2018-01-16T17:30:00Z,The winners and losers of the Detroit Auto Show,CNBC sums up the winners and losers of the 2018 Detroit Auto Show.,tesla,CNBC
244,2018-01-29T10:40:00Z,Elon Musk’s Boring Company sold $3.5 million worth of flamethrowers,"Elon Musk said in December that, if The Boring Company sold 50,000 hats, it would start selling flamethrowers.",tesla,CNBC
245,2018-02-13T04:00:09Z,Teslas Are Finally Replacing Porsches on the Autobahn,"With a charging network five times more dense than that in America, Germany is poised to become the world's No.3 electric-car market.",tesla,Bloomberg
246,2018-03-28T22:22:37Z,Investors Aren't Breaking Up With Tech—Yet - Bloomberg,"Bloomberg Investors Aren't Breaking Up With Tech —Yet Bloomberg Tom Ognar isn't used to having to explain his big bet on tech stocks like this. After all, the portfolio manager of the $4.5 billion Wells Fargo Growth Fund beat 93 percent of peers over the past…",tesla,Bloomberg
247,2018-03-19T09:00:12Z,What Model 3 Drivers Love and Hate About Tesla's Pivotal Car,Reviews of the sedan Elon Musk is counting on for growth are rolling in.,tesla,Bloomberg
248,2018-02-22T17:45:00Z,"Korean Cars Pull Ahead of German Brands, Consumer Reports Says","In the pantheon of luxury carmakers, Hyundai Motor Co. doesn't usually come to mind. But the Korean company's Genesis line beat out German rivals to be named 2018's best car brand in the U.S. by Consumer Reports.",tesla,Bloomberg
249,2018-03-13T09:00:00Z,GM Is Planning an Airbnb-Like Service for Cars,"General Motors Co. plans to start a pilot program this summer that will enable car owners to rent out their vehicles when they aren't using them, according to people familiar with the matter.",tesla,Bloomberg
250,2018-03-06T00:01:00Z,The Oligarchs' Feud That Will Affect Electric Cars,"Russian billionaires are feuding over control of a giant natural-resource business that dates back to the Soviet era. So far, so Russia. What makes the battle for MMC Norilsk Nickel PJSC more important than typical business maneuvering is that it will affect …",tesla,Bloomberg
251,2018-02-22T17:45:00Z,Hyundai luxury brand Genesis ranked No. 1 by Consumer Reports,"Genesis, the luxury brand started by Hyundai just over two years ago, is the highest-rated brand in Consumer Reports' 2018 ranking.",tesla,CNBC
252,2018-03-29T10:30:21Z,"WSJ Wealth Adviser Briefing: Bear Market, Financial Cheaters, Tiger Woods","Abigail Gunderson, wealth adviser at Tanglewood Total Wealth Management in Houston, has developed a few strategies to guide clients with large holdings of company stock to minimize taxes, maximize returns and overcome any emotional attachments to their portfo…",tesla,The Wall Street Journal
253,2018-03-26T12:05:00Z,"Stocks making the biggest moves premarket: USG, INTC, BA, FB, GE, C, TSLA & more",These are the stocks posting the largest moves before the bell.,tesla,CNBC
254,2018-03-27T13:40:00Z,Elon Musk will sell 'Lego-like' bricks made of rock from The Boring Company dig,The Boring Company already sold out of caps and flamethrowers emblazoned with the company logo.,tesla,CNBC
255,2018-03-26T10:30:24Z,Fly Charts: Tesla's Cash Crunch and China's Trade War Strategy,"From Glaxo reticence to British restaurant woes, here are four charts that tell you what you need to know in business today.",tesla,Bloomberg
256,2018-03-21T20:29:39Z,Your Evening Briefing,Want to receive this post in your inbox every afternoon? Sign up here.,tesla,Bloomberg
257,2018-03-01T17:51:00Z,Elon Musk responds to Harvard professor Steven Pinker’s comments on A.I.,The tech billionaire tweets about the famous cognitive scientist's comprehension of artificial intelligence.,tesla,CNBC
258,2018-02-07T19:08:00Z,O'Leary rides Boeing to win CNBC Stock draft competition,O'Leary took down 7 other teams in the contest that ran from April 27th until the Friday before the Super Bowl.,tesla,CNBC
259,2018-03-20T18:57:32Z,Facebook Just Lost More Than Tesla's Entire Market Cap in Two Days,Facebook Just Lost More Than Tesla's Entire Market Cap in Two Days bloomberg.com,tesla,Bloomberg
260,2018-02-06T22:00:44Z,This is What Elon Musk Saving $90 Million Looks Like,His successful Falcon Heavy launch was matched by a simultaneous landing of twin reusable boosters.,tesla,Bloomberg
261,2018-03-05T17:54:00Z,Cadillac's self-driving system is better than Tesla's or Volvo's,CNBC tested Cadillac's Super Cruise autonomous system and it's the best we've used.,tesla,CNBC
262,2018-02-22T14:56:00Z,Watch: New York Fed's Dudley speaks on Puerto Rico's economic outlook,The New York Fed President will join a panel of economists to talk about the economic conditions in Puerto Rico and the U.S. Virgin Islands,tesla,CNBC
263,2018-02-14T02:57:25Z,"AI will be ‘billions of times’ smarter than humans and man needs to merge with it, expert says","By Arjun Kharpal Artificial intelligence could be “billions of times smarter” than humans and people may need to merge with computers to survive, a futurist told CNBC on Tuesday. Speaking on a panel hosted by CNBC at the World Government Summit in Dubai, Futu…",tesla,CNBC
264,2018-01-16T22:00:52Z,A Steelmaker's Plan to Win Back the Car of the Future,"ArcelorMittal believes electric vehicles could favor the stronger, cheaper metal.",tesla,Bloomberg
265,2018-01-30T13:17:00Z,"Stocks making the biggest moves premarket: AMZN, BRKB, JPM, AAPL, BX, TSLA & more",These are the stocks posting the largest moves before the bell.,tesla,CNBC
266,2018-01-29T03:02:42Z,"The Wall Street Journal: Alibaba, Foxconn lead big investment in Chinese electric-car maker","Chinese e-commerce giant Alibaba Group Holding Ltd. and Foxconn Technology Group have co-led a 2.2 billion yuan ($348 million) funding round into Chinese electric-vehicle manufacturer Xiaopeng Motors, marking Alibaba’s first big investment in a car maker",tesla,The Wall Street Journal
267,2018-01-05T13:41:00Z,"Your first trade for Friday, January 5","The ""Fast Money"" traders share their first moves for the market open.",tesla,CNBC
268,2018-01-08T09:52:52Z,Elon Musk’s SpaceX successfully launches secret government spacecraft then lands rocket back on Earth,"By Arjun Kharpal SpaceX successfully launched a secret U.S. government payload called Zuma on Sunday and landed its rocket back on Earth, in the company’s first mission of 2018. The Zuma spacecraft was attached to one of SpaceX’s Falcon 9 rockets. It was laun…",tesla,CNBC
269,2018-01-08T09:14:00Z,Elon Musk's SpaceX successfully launches secret government spacecraft then lands rocket back on Earth,"After launching Zuma into orbit, SpaceX successfully landed its Falcon 9 rocket back on Earth.",tesla,CNBC
270,2018-01-16T18:22:31Z,BMW Bets on Old-Fashioned Car Ownership,The German car maker has bought mobile-based parking vendor Parkmobile,tesla,The Wall Street Journal
271,2018-01-13T15:00:00Z,Bitcoin backer Cameron Winklevoss shares his 2 favorite science fiction books,"Bitcoin investor and co-founder of Gemini, Cameron Winklevoss reveals two of his favorite novels in a 2013 Reddit Ask Me Anything post.",tesla,CNBC
272,2018-01-25T14:01:00Z,Kevin O'Leary had pizza and beer at his wedding—why he says you should too,"""Shark Tank"" investor and personal finance author Kevin O'Leary explains how much you should spend on a wedding and engagement ring.",tesla,CNBC
273,2018-01-28T16:30:00Z,Why Dave Grohl puts every paycheck in the bank and drives a 'family car',"Rock star Dave Grohl of the Foo Fighters still prioritizes saving money: ""I don't waste my time thinking about how I could make more.""",tesla,CNBC
274,2018-01-04T14:32:00Z,"Dow breaks above 25,000 for the first time ever after strong jobs data",The S&P 500 and Nasdaq composite also hit record highs.,tesla,CNBC
275,2018-01-06T16:40:44Z,Takata Recalls Another 3.3 Million Air Bags Under U.S. Order,"Takata Corp., the parts supplier that filed for bankruptcy after sparking the largest auto recall in history, called back 3.3 million air bags as part of a U.S. order that scheduled repairs of the potentially deadly devices over several years.",tesla,Bloomberg
276,2018-01-06T00:33:00Z,"Top VC deals: Apple buys Buddybuild, Google backs Chinese Twitch competitor, and robotic manicures","A weekly recap of some of the most interesting venture capital deals, funds and start-ups.",tesla,CNBC
277,2018-03-21T10:47:07Z,CEO Pay Hits Record Highs on Stock Market's Surge,The chief executives of America’s biggest companies are on track for another banner year of compensation. Median pay for the chief executives of 133 of the largest U.S. companies reached an all-time high of $11.6 million in 2017.,tesla,The Wall Street Journal
278,2018-02-08T13:07:00Z,"Stocks making the biggest moves premarket: TWTR, REGN, YUM, GRUB, CVS, TMUS & more",These are the stocks posting the largest moves before the bell.,tesla,CNBC
279,2018-03-08T15:05:18Z,The Battery Will Kill Fossil Fuels—It's Only a Matter of Time,"Three weeks ago, a U.S. agency sent the clearest signal yet that fossil fuels’ days are numbered.",tesla,Bloomberg
280,2018-03-01T17:33:00Z,Elon Musk’s brother Kimbal: This was the 'best decision of my life',"Kimbal Musk, Elon Musk's brother, recently held a Reddit AMA where he discussed his work as an entrepreneur.",tesla,CNBC
281,2018-02-20T10:48:00Z,Home Depot is about to report earnings — Here's what the Street expects,"Home Depot continues to thrive alongside its rival Lowe's, as their business models are much more difficult to replicate online.",tesla,CNBC
282,2018-02-06T21:04:48Z,SpaceX Launches World's Biggest Rocket,"Space Exploration Technologies Corp. successfully launched the Falcon Heavy rocket on its initial test flight, marking another historic coup for founder Elon Musk.",tesla,The Wall Street Journal
283,2018-03-09T03:45:33Z,Uber Calls Lenders for $1.25 Billion in Wall Street Shortcut,"Inside New York’s St. Regis Hotel on Friday, debt investors were given what’s becoming a familiar pitch: a high-flying tech company with a charismatic leader but no real cash flow was asking them to lend it money.",tesla,Bloomberg
284,2018-03-28T21:08:26Z,The Wall Street Journal: Internal Justice watchdog to review surveillance of ex-Trump adviser,The Justice Department’s internal watchdog will investigate how the FBI and federal prosecutors obtained warrants from the nation’s secret spy court to surveil former Trump campaign adviser Carter Page.,tesla,The Wall Street Journal
285,2018-03-29T01:10:57Z,The Wall Street Journal: Kushner may see diminished role after Trump’s national-security shakeup,"President Donald Trump’s shakeup of his national security team is likely to reshape the role played by Jared Kushner, a key adviser whose global portfolio created friction with outgoing Secretary of State Rex Tillerson, administration officials and others clo…",tesla,The Wall Street Journal
286,2018-03-28T21:54:37Z,The Wall Street Journal: Uber freight-trucking executive Lior Ron leaving the company,"Uber Technologies Inc.’s head of freight trucking, Lior Ron, who helped work on autonomous-vehicle technology, is leaving the company, a prominent departure in the wake of a controversial crash involving one of its self-driving vehicles.",tesla,The Wall Street Journal
287,2018-03-29T00:16:37Z,Facebook to limit the information it shares with data brokers,"Facebook Inc. is curbing the information that it exchanges with companies that collect and sell consumer data for advertisers, as the social-media giant tries to calm an uproar over its handling of personal information.",tesla,The Wall Street Journal
288,2018-03-29T02:39:38Z,"The Wall Street Journal: U.S. wants NATO to have force of 30,000 ready to deploy if Russia attacks","If Europe came into conflict with Russia, only several thousand of the more than 1 million troops in its armies would be ready for rapid deployment, military planners fear.",tesla,The Wall Street Journal
289,2018-03-13T17:22:00Z,Elon Musk: ‘Mark my words — A.I. is far more dangerous than nukes’,The billionaire tech entrepreneur urgently called for oversight of the development of machine intelligence.,tesla,CNBC
290,2018-03-20T14:37:18Z,It's a Good Thing Europe's Autonomous Car Testing Is Slow,"Europe's slower and more regulated testing of autonomous vehicles may reduce the likelihood of the kind of accidents seen this week in the U.S., industry experts said.",tesla,Bloomberg
291,2018-03-09T13:16:00Z,"Stocks making the biggest moves premarket: BA, DIS, CHK, WYNN, AMZN, KSS & more",These are the stocks posting the largest moves before the bell.,tesla,CNBC
292,2018-02-07T10:37:00Z,US stocks set for a lower open as volatile trading continues,"U.S. stock index futures dropped deep into the red ahead of Wednesday’s open, pulling back from the roller coaster ride on Wall Street in the previous session.",tesla,CNBC
293,2018-03-27T20:58:00Z,"Popular tech stocks like Nvidia, Twitter get smoked as investors fear tech backlash",Several of the market's favorite technology stocks tanked as investors grew concerned over the companies' growth markets following new developments Tuesday.,tesla,CNBC
294,2018-03-28T04:03:00Z,Lincoln brings back the Aviator after more than a decade — with a very different design,"The 2019 Aviator will be a bit smaller than the extremely popular Navigator, and will offer a plug-in hybrid option.",tesla,CNBC
295,2018-03-29T22:20:00Z,"After-hours buzz:After-hours buzz: UAA, TSLA, SNX & NVR",See which stocks are posting big moves after the bell.,tesla,CNBC
296,2018-03-28T21:08:26Z,Internal Justice watchdog to review surveillance of ex-Trump adviser,The Justice Department’s internal watchdog will investigate how the FBI and federal prosecutors obtained warrants from the nation’s secret spy court to surveil former Trump campaign adviser Carter Page.,tesla,The Wall Street Journal
297,2018-03-28T21:17:39Z,The Wall Street Journal: ‘Roseanne’ is a huge hit in return to ABC,"The season premiere of the rebooted working-class comedy, starring the original cast including Roseanne Barr and John Goodman, averaged 18.2 million viewers over two back-to-back episodes, according to data from Nielsen.",tesla,The Wall Street Journal
298,2018-02-08T12:34:01Z,France’s Total Rewards Investors After Oil Downturn—Energy Journal,Big Oil Rewards Investors Again,tesla,The Wall Street Journal
299,2018-03-29T06:28:29Z,Stock Rout Wipes $141 Billion Off China's Three Tech Kings,China’s walled off tech universe isn’t offering its biggest companies much protection from the global equity rout.,tesla,Bloomberg
300,2018-03-28T22:20:44Z,The Wall Street Journal: Trump ousts embattled David Shulkin as VA secretary,"President Donald Trump on Wednesday ousted his embattled Veterans Affairs secretary, David Shulkin, in the wake of an internal investigation that found he had misused taxpayer dollars on a recent trip to Europe.",tesla,The Wall Street Journal
